{
  "$schema": "https://json-schema.org/draft/2020-12/schema",
  "title": "SourceIngestionManifestV1",
  "type": "object",
  "required": ["source_name", "source_path", "output_path", "records_written", "created_at"],
  "properties": {
    "source_name": {"type": "string"},
    "source_path": {"type": "string"},
    "output_path": {"type": "string"},
    "records_written": {"type": "integer", "minimum": 0},
    "created_at": {"type": "string"},
    "doc_count": {"type": "integer", "minimum": 0},
    "notes": {"type": ["string", "null"]},
    "top_documents": {
      "type": "array",
      "items": {"type": "object", "additionalProperties": true}
    }
  },
  "additionalProperties": true
}
